{"schema_version":"urpg.community_wysiwyg.v1","id":"developer_debug_overlay_default","feature_type":"developer_debug_overlay","display_name":"Developer Debug Overlay","visual_layers":["console_commands","region_overlay","quick_reload","dev_save_tools"],"actions":[{"id":"open_debug_console","label":"Open Debug Console","trigger":"debug_hotkey","command":"open_debug_console","target":"debug_overlay","required_flags":["dev_mode"],"parameters":{"tools":"gold,party,actors,common_events,battle_test,map_transfer,dev_save,quick_reload,region_ids"}},{"id":"toggle_region_overlay","label":"Toggle Region Overlay","trigger":"region_overlay_hotkey","command":"toggle_overlay","target":"region_ids","required_flags":["dev_mode"],"parameters":{"overlay":"region_ids"}}]}
